{
  "id": "obj_b2b-saas",
  "object_type": "Objective",
  "schema_version": "1.0.0",
  "business_id": "b2b-saas",
  "created_at": "2026-08-18T00:00:00Z",
  "updated_at": "2026-08-18T00:00:00Z",
  "lineage": [],
  "name": "Increase qualified pipeline",
  "metric_refs": [],
  "target": {},
  "horizon": "12 months",
  "priority": 1
}
